{
  "schemaVersion": "1.0",
  "nationalDex": 1,
  "slug": "bulbasaur",
  "names": {
    "en": "Bulbasaur",
    "de": "Bisasam"
  },
  "generation": 1,
  "category": {
    "en": "Seed Pokémon",
    "de": "Samen-Pokémon"
  },
  "types": [
    "grass",
    "poison"
  ],
  "abilities": {
    "regular": [
      "overgrow"
    ],
    "hidden": "chlorophyll"
  },
  "baseStats": {
    "hp": 45,
    "attack": 49,
    "defense": 49,
    "specialAttack": 65,
    "specialDefense": 65,
    "speed": 45
  },
  "heightM": 0.7,
  "weightKg": 6.9,
  "evolution": {
    "familyId": "bulbasaur-line",
    "from": null,
    "to": [
      {
        "nationalDex": 2,
        "method": "level:16"
      }
    ]
  },
  "gameData": {
    "learnset": [],
    "encounters": [],
    "heldItems": []
  },
  "overrides": [],
  "sources": [
    {
      "id": "pokeapi-species-1",
      "title": "PokéAPI species and Pokémon records",
      "kind": "api",
      "gameVersion": "standard",
      "status": "verified",
      "notes": "Standard baseline only; HGG overrides must be documented separately."
    }
  ]
}